Sheet: Sheet1
A1: CommentID | B1: CommentContent | C1: CommentInVideoTime | D1: CommentDate | E1: CommenterName | F1: offset | G1: CorrectCensorType | H1: UpvoteReactionText | I1: MuteReactionText | J1: Tendency1Score | K1: Tendency2Score
A2: ID Of Comment | B2: Text Content | C2: float | D2: Date | E2: string | F2: interger | G2: integer | H2: text | I2: text | J2: float | K2: float
A3: int | B3: string | C3: float | D3: date | E3: string | F3: float | G3: int | H3: string | I3: string | J3: float | K3: float
A4: 1 | B4: Hello, guys. | C4: 1 | D4: 03/08/2018 | E4: Bili | F4: =RANDBETWEEN(0,5.5) -> 1 | G4: 0 | H4: Haha… | I4: Oh wait… | J4: 0 | K4: 0
A5: 2 | B5: LMAO | C5: 4 | D5: 03/06/2018 | E5: Bili | F5: =RANDBETWEEN(0,5.5) -> 3 | G5: 0 | H5: Haha… | I5: Oh wait… | J5: 0 | K5: 0
A6: 3 | B6: Welcome to Horror fun time. | C6: 7 | D6: 03/08/2018 | E6: Bili | F6: =RANDBETWEEN(0,5.5) -> 3 | G6: 0 | H6: Haha… | I6: Oh wait… | J6: 0 | K6: 0
A7: 4 | B7: make your tail bigger with these weird tricks | C7: 10 | D7: 03/02/2018 | E7: Bili | F7: =RANDBETWEEN(0,5.5) -> 5 | G7: 0 | H7: It needs to be spread out. | I7: Oh wait… | J7: 0 | K7: 0
A8: 5 | B8: This fat boy looks delicious | C8: 11 | D8: 03/08/2018 | E8: Bili | F8: =RANDBETWEEN(0,5.5) -> 0 | G8: 0 | H8: Haha… | I8: Oh just joking | J8: 0 | K8: 0
A9: 6 | B9: This show has me in stitches! #greatjob | C9: 13 | D9: 03/09/2021 | E9: Bili | F9: =RANDBETWEEN(0,5.5) -> 2 | G9: 1 | H9: Haha… | I9: Oh wait… | J9: 0 | K9: 0
A10: 7 | B10: #greatjob | C10: 16 | D10: 03/08/2018 | E10: Bili | F10: =RANDBETWEEN(0,5.5) -> 0 | G10: 1 | H10: Haha… | I10: Oh wait… | J10: 0 | K10: 0
A11: 8 | B11: Here it is. | C11: 19 | D11: 03/09/2018 | E11: Bili | F11: =RANDBETWEEN(0,5.5) -> 3 | G11: 0 | H11: I am innocent! | I11: I am not with that guy! | J11: 0 | K11: 0
A12: 9 | B12: I really like this show. | C12: 22 | D12: 03/09/2018 | E12: Bili | F12: =RANDBETWEEN(0,5.5) -> 3 | G12: 1 | H12: Haha… | I12: Oh wait… | J12: 0 | K12: 0
A13: 10 | B13: It reminds me of the good old times. | C13: 25 | D13: 03/09/2018 | E13: Bili | F13: =RANDBETWEEN(0,5.5) -> 5 | G13: 1 | H13: Haha… | I13: Oh wait… | J13: 0 | K13: 0
A14: 11 | B14: Is that so? | C14: 28 | D14: 03/09/2018 | E14: Bili | F14: =RANDBETWEEN(0,5.5) -> 3 | G14: 0 | H14: Haha… | I14: Oh wait… | J14: 0 | K14: 0
A15: 12 | B15: I can't wait for these humans to go extinct | C15: 31 | D15: 03/08/2018 | E15: Bili | F15: =RANDBETWEEN(0,5.5) -> 5 | G15: 2 | H15: We hate human don’t we? | I15: Oh wait… | J15: 0 | K15: 0
A16: 13 | B16: Hiring hackerz $50/hr to hax DDB | C16: 34 | D16: 03/08/2018 | E16: Bili | F16: =RANDBETWEEN(0,5.5) -> 2 | G16: 2 | H16: Glad u hate DDB as well | I16: Sorry I am paid for this | J16: 0 | K16: 0
A17: 14 | B17: Hahaha, you know we'd never actually eat anybody! | C17: 37 | D17: 03/08/2018 | E17: Bili | F17: =RANDBETWEEN(0,5.5) -> 3 | G17: 1 | H17: Haha… | I17: Oh wait… | J17: 0 | K17: 0
A18: 15 | B18: ROFL the look on their face is priceless | C18: 40 | D18: 03/08/2018 | E18: Bili | F18: =RANDBETWEEN(0,5.5) -> 2 | G18: 1 | H18: Haha… | I18: Oh wait… | J18: 0 | K18: 0
A19: 16 | B19: #DDB the TV for me! | C19: 43 | D19: 03/08/2018 | E19: Bili | F19: =RANDBETWEEN(0,5.5) -> 3 | G19: 1 | H19: Haha… | I19: Oh wait… | J19: 0 | K19: 0
A20: 17 | B20: I love Double D TV! | C20: 46 | D20: 03/08/2018 | E20: Bili | F20: =RANDBETWEEN(0,5.5) -> 1 | G20: 1 | H20: Haha… | I20: Oh wait… | J20: 0 | K20: 0
A21: 18 | B21: He doesn’t wear proper uniforms for dinner, how embarrasing. | C21: 49 | D21: 03/09/2018 | E21: Bili | F21: =RANDBETWEEN(0,5.5) -> 3 | G21: 2 | H21: Haha… | I21: Oh wait… | J21: 0 | K21: 0
A22: 19 | B22: omg he looks sooo tasty | C22: 52 | D22: 03/08/2018 | E22: Bili | F22: =RANDBETWEEN(0,5.5) -> 3 | G22: 2 | H22: Haha… | I22: Sorry for being honest | J22: 0 | K22: 0
A23: 20 | B23: cheap teeth filing legal licensed dentiss @ Smoothieteeth.com | C23: 55 | D23: 03/08/2018 | E23: Bili | F23: =RANDBETWEEN(0,5.5) -> 2 | G23: 2 | H23: Thanks for the promotion | I23: Hey I just try to help people | J23: 0 | K23: 0
A24: 21 | B24: damn thumbys | C24: 58 | D24: 03/09/2018 | E24: Bili | F24: =RANDBETWEEN(0,5.5) -> 2 | G24: 2 | H24: Haha… | I24: Oh wait… | J24: 0 | K24: 0
A25: 22 | B25: Normally I would be scared but it's a prank so it's fine! | C25: 61 | D25: 03/08/2018 | E25: Bili | F25: =RANDBETWEEN(0,5.5) -> 5 | G25: 1 | H25: Haha… | I25: Oh wait… | J25: 0 | K25: 0
A26: 23 | B26: Don't know why people are mad, it's just a joke bro | C26: 64 | D26: 03/08/2018 | E26: Bili | F26: =RANDBETWEEN(0,5.5) -> 1 | G26: 1 | H26: Haha… | I26: Oh wait… | J26: 0 | K26: 0
A27: 24 | B27: What? This show again? | C27: 67 | D27: 03/08/2018 | E27: Bili | F27: =RANDBETWEEN(0,5.5) -> 0 | G27: 0 | H27: Haha… | I27: Oh wait… | J27: 0 | K27: 0
A28: 25 | B28: fucking ugly polydactyls | C28: 70 | D28: 03/08/2018 | E28: Bili | F28: =RANDBETWEEN(0,5.5) -> 5 | G28: 2 | H28: Haha… | I28: Oh wait… | J28: 0 | K28: 0
A29: 26 | B29: Guys, these sub-human are not worth watching | C29: 73 | D29: 03/09/2018 | E29: Bili | F29: =RANDBETWEEN(0,5.5) -> 5 | G29: 0 | H29: Haha… | I29: Oh wait… | J29: 0 | K29: 0
A30: 27 | B30: fucking ugly polydactyls | C30: 76 | D30: 03/08/2018 | E30: Bili | F30: =RANDBETWEEN(0,5.5) -> 2 | G30: 2 | H30: Haha… | I30: Oh wait… | J30: 0 | K30: 0
A31: 28 | B31: lick my buthole | C31: 79 | D31: 03/08/2018 | E31: Bili | F31: =RANDBETWEEN(0,5.5) -> 4 | G31: 2 | H31: Haha… | I31: Oh wait… | J31: 0 | K31: 0
A32: 29 | B32: KILL ALL HUMIES | C32: 82 | D32: 03/08/2018 | E32: Bili | F32: =RANDBETWEEN(0,5.5) -> 2 | G32: 2 | H32: We hate them don’t we? | I32: Oh wait… | J32: 0 | K32: 0
A33: 30 | B33: LMAO hatecrime | C33: 85 | D33: 03/09/2018 | E33: Bili | F33: =RANDBETWEEN(0,5.5) -> 0 | G33: 2 | H33: Haha… | I33: Oh wait… | J33: 0 | K33: 0
A34: 31 | B34: Fucking kill him!!!! | C34: 88 | D34: 03/08/2018 | E34: Bili | F34: =RANDBETWEEN(0,5.5) -> 5 | G34: 2 | H34: Haha… | I34: Oh wait… | J34: 0 | K34: 0
A35: 32 | B35: This is problematic | C35: 91 | D35: 03/08/2018 | E35: Bili | F35: =RANDBETWEEN(0,5.5) -> 3 | G35: 2 | H35: Haha… | I35: Oh wait… | J35: 0 | K35: 0
A36: 33 | B36: Go suck a bunch of chicken eggs you dino fucks | C36: 94 | D36: 03/09/2018 | E36: Bili | F36: =RANDBETWEEN(0,5.5) -> 0 | G36: 2 | H36: Haha… | I36: Oh wait… | J36: 0 | K36: 0
A37: 34 | B37: Get cucked thumby | C37: 97 | D37: 03/08/2018 | E37: Bili | F37: =RANDBETWEEN(0,5.5) -> 4 | G37: 2 | H37: Haha… | I37: Oh wait… | J37: 0 | K37: 0
A38: 35 | B38: DDB sucks | C38: 100 | D38: 03/09/2018 | E38: Bili | F38: =RANDBETWEEN(0,5.5) -> 2 | G38: 2 | H38: Haha… | I38: Oh wait… | J38: 0 | K38: 0
A39: 36 | B39: 8==========D-----— | C39: 103 | D39: 03/08/2018 | E39: Bili | F39: =RANDBETWEEN(0,5.5) -> 1 | G39: 2 | H39: Haha… | I39: Oh wait… | J39: 0 | K39: 0
A40: 37 | B40: LEGALIZE EATTING HUMIES | C40: 106 | D40: 03/08/2018 | E40: Bili | F40: =RANDBETWEEN(0,5.5) -> 5 | G40: 2 | H40: Haha… | I40: Oh wait… | J40: 0 | K40: 0
A41: 38 | B41: Dinosaur privilege Dinosaur Priviliage | C41: 109 | D41: 03/09/2018 | E41: Bili | F41: =RANDBETWEEN(0,5.5) -> 2 | G41: 2 | H41: Haha… | I41: Oh wait… | J41: 0 | K41: 0
A42: 39 | B42: Lol, this show is great | C42: 112 | D42: 03/08/2018 | E42: Bili | F42: =RANDBETWEEN(0,5.5) -> 1 | G42: 1 | H42: Haha… | I42: Oh wait… | J42: 0 | K42: 0
A43: 40 | B43: Hahah! That human didn't see that coming | C43: 115 | D43: 03/08/2018 | E43: Bili | F43: =RANDBETWEEN(0,5.5) -> 2 | G43: 1 | H43: Haha… | I43: Oh wait… | J43: 0 | K43: 0
A44: 41 | B44: Watching this show makes me feel #blessed | C44: 118 | D44: 03/09/2018 | E44: Bili | F44: =RANDBETWEEN(0,5.5) -> 4 | G44: 1 | H44: Haha… | I44: Oh wait… | J44: 0 | K44: 0
A45: 42 | B45: <3<3<3<3<3 | C45: 121 | D45: 03/08/2018 | E45: Bili | F45: =RANDBETWEEN(0,5.5) -> 4 | G45: 1 | H45: Haha… | I45: Oh wait… | J45: 0 | K45: 0
A46: 43 | B46: #PRANKED! | C46: 124 | D46: 03/08/2018 | E46: Bili | F46: =RANDBETWEEN(0,5.5) -> 5 | G46: 1 | H46: Haha… | I46: Oh wait… | J46: 0 | K46: 0
A47: 44 | B47: OMG everyone is so goregous, espcially Rex Tino! | C47: 127 | D47: 03/08/2018 | E47: Bili | F47: =RANDBETWEEN(0,5.5) -> 2 | G47: 1 | H47: Haha… | I47: Oh wait… | J47: 0 | K47: 0
A48: 45 | B48: REX TINO I LOVE YOU | C48: 130 | D48: 03/08/2018 | E48: Bili | F48: =RANDBETWEEN(0,5.5) -> 5 | G48: 1 | H48: Haha… | I48: Oh wait… | J48: 0 | K48: 0